{"candidate":"a0bf31604cc760631ba48b8fee574f89ef120cc8","clientFloors":{"claude":"2.1.216","codex":"0.144.6"},"commands":[{"client":"claude","exit":0,"opKey":"install-2","outputHash":"b56d72e1f65c44ab50d142e557449d144db8f4da92f3977d168bbc35d49583f4","substep":"claude-install-2"},{"client":"claude","exit":0,"opKey":"install","outputHash":"9fa5b13bab55c2639c670c078667e938a64aacdc1db3826a77cfc471f9e29102","substep":"claude-install"},{"client":"claude","exit":0,"opKey":"marketplace-add","outputHash":"91d823233cbbafe3e59245b626bcbd3c1c1033595d70543de9bd23d58e86e533","substep":"claude-marketplace-add"},{"client":"claude","exit":0,"opKey":"marketplace-remove","outputHash":"718fed62123e8b4eebff6db7457bd6067c32b458a70b6d93b0ef0a5d4342c673","substep":"claude-marketplace-remove"},{"client":"claude","exit":0,"opKey":"uninstall","outputHash":"099f7acd539df43204c1b7b442ce34f2d39bc8f85b9149fa1677fc8189cd6686","substep":"claude-uninstall"},{"client":"codex","exit":0,"opKey":"install-2","outputHash":"6938980f43998e1332c0f99414d2740d3582ccd55bc6a5b052567fadcdb0750e","substep":"codex-install-2"},{"client":"codex","exit":0,"opKey":"install","outputHash":"6938980f43998e1332c0f99414d2740d3582ccd55bc6a5b052567fadcdb0750e","substep":"codex-install"},{"client":"codex","exit":0,"opKey":"marketplace-add","outputHash":"a3ccfd41fb01dc0f8e7de450d98056c35dd47b0c69c0851832faee47163513ca","substep":"codex-marketplace-add"},{"client":"codex","exit":0,"opKey":"marketplace-remove","outputHash":"f8dc62cd66acf0df7218ee1dd8e2688ab07e2d4616e2d98aa8671f07bb274881","substep":"codex-marketplace-remove"},{"client":"codex","exit":0,"opKey":"uninstall","outputHash":"8be4125c01befc528d355009c91223d41b880bda6f1c31ea8145de8c14d4b3fc","substep":"codex-uninstall"},{"client":"claude","exit":0,"opKey":"role-launch","outputHash":"d23965aa559b064cc49ad37bad7180ea4d130b34c0abf22b4f3d7dab87a1a822","substep":"claude-role-launch"},{"client":"claude","exit":0,"opKey":"hook-trust","outputHash":"observed","substep":"claude-hook-trust"},{"client":"claude","exit":0,"opKey":"list-project","outputHash":"eb2d22115886c365ca88bf63ebb32e938e4c6f81d3bef1c80d7479a4d090af72","substep":"claude-list-project"},{"client":"claude","exit":0,"opKey":"list-outside","outputHash":"eb2d22115886c365ca88bf63ebb32e938e4c6f81d3bef1c80d7479a4d090af72","substep":"claude-list-outside"},{"client":"claude","exit":0,"opKey":"helper-root","outputHash":"fe64b30af0de4870c9c53de81c8773df4af68375ad1f822d97f5e45634fcfcb3","substep":"claude-helper-root"},{"client":"codex","exit":1,"opKey":"role-launch","outputHash":"b772f509b7c51e71329e772247500b5b8ac4fea5ad6917ba3e6b71891b075384","substep":"codex-role-launch"},{"client":"codex","exit":0,"opKey":"hook-trust","outputHash":"observed","substep":"codex-hook-trust"},{"client":"codex","exit":0,"opKey":"list-project","outputHash":"db8cf102f46a4b6e44caa072f169fc7e8d627f9aac7a2f5e0aed49b7923a902b","substep":"codex-list-project"},{"client":"codex","exit":0,"opKey":"list-outside","outputHash":"db8cf102f46a4b6e44caa072f169fc7e8d627f9aac7a2f5e0aed49b7923a902b","substep":"codex-list-outside"},{"client":"codex","exit":0,"opKey":"helper-root","outputHash":"5c06c77116974acfd448ab14b9992fb6cade67c78ddeb4fc213d81d769b4f02a","substep":"codex-helper-root"}],"exit":4,"fixtureHash":"71e53d084289aba1703ef49d8723f011d5a7985e510bff53cfedad04a98b634a","harnessHash":"cd765dd16c31e49121f5fcfbb008205a2603692159f2b519835a2518557cfb90","marker":"RQbHF6ARxqWnI2a466896","platform":"darwin-arm64","postInventoryHash":"0f0eb46f3cd498e8609426bab74fd3562a3a64cb4958c09187b5bc3b83ca2d1d","preInventoryHash":"37517e5f3dc66819f61f5a7bb8ace1921282415f10551d2defa5c3eb0985b570","quarantineReason":"Codex cold role launch (loom-launch-role codex researcher) got 401 Unauthorized from api.openai.com/v1/responses: the isolated CODEX_HOME has no auth.json (never seeded from the owner real config, by design), so it cannot authenticate. All 10 native mutations for both clients, both clients list/discovery (inside/outside project), hook-trust, and helper-root probes succeeded, and the Claude cold role launch succeeded fully. Only the Codex role-launch leg is infrastructure-blocked.","roleReturn":{"boundedOutputHash":"d23965aa559b064cc49ad37bad7180ea4d130b34c0abf22b4f3d7dab87a1a822","client":"claude","cold":true,"delegation":false,"role":"researcher"},"roots":{"claudeHome":"$RUN_ROOT/claude-home","codexHome":"$RUN_ROOT/codex-home","project":"$RUN_ROOT/project","systemHome":"$RUN_ROOT/system-home","tmp":"$RUN_ROOT/tmp"},"runId":"RQbHF6ARxqWnI2a466896","schema":"loom-dogfood-evidence/v1","schemaHash":"d575069a744cc28ed20096a3613093f087c737bdbe7f81e65b050ed4af1ff74f","state":"infrastructure-blocked","tree":"e5728c3ba9c97c6aa475b46a9437783130171d5b","trustResult":"claude: git-identity-guard observed exit 0 (pre-tool-use/allow fixture, CLAUDE_PLUGIN_ROOT); codex: same hook observed exit 0 via PLUGIN_ROOT."}
